{
  "contractId": "PoolActionFv2/falsifier-contract/v3",
  "relationId": "PoolActionFv2",
  "relationVersion": 2,
  "abiVersion": 3,
  "status": "AUTHORIZED_SUCCESSOR_STATIC_FALSIFIER_CONTRACT_ONLY",
  "authority": "bounded-contract-only",
  "namespacePolicy": {
    "packageNamespace": "spec/poolaction-fv2-falsifier-contract-v3",
    "abiNamespace": "shieldkit-labs/poolaction-fv2/falsifier-contract/v3",
    "binaryVersion": 3,
    "runtimeMagic": "P3",
    "hashDomainSuffix": "/v3",
    "forbiddenV2Tokens": [
      "/v2",
      "P2DM",
      "P2TV",
      "P2SG",
      "P2GR",
      "P2PE",
      "P2RI",
      "P2RT",
      "P2TS",
      "P2PI"
    ]
  },
  "retainedV2FamilyCount": 73,
  "additiveAbi3FamilyCount": 26,
  "rowCount": 99,
  "materializedVariantCount": 0,
  "executedVariantCount": 0,
  "passedVariantCount": 0,
  "statusCounts": {
    "PLANNED": 99,
    "MATERIALIZED": 0,
    "EXECUTED": 0,
    "PASSED": 0
  },
  "lineageCounts": {
    "V2_RETAINED": 73,
    "ABI3_ADDITIVE": 26
  },
  "requiredAdditiveFamilyIds": [
    "A3-MANIFEST-MUTATION-ORIGINAL-LOCKS",
    "A3-MANIFEST-STATE-CATEGORY-COORDINATED",
    "A3-REDEEM-REPLACEMENT-UNCHANGED-LOCK",
    "A3-N3-ORDINAL-LOCK-REDEEM-FRAME-SOURCE-SWAPS",
    "A3-ACTION-DISPLAY-FLIP-REMOVAL",
    "A3-STATE-DELTA-BOUNDARIES-BOTH-TOPOLOGIES",
    "A3-SOURCE-TABLE-LEAF-COVERAGE",
    "A3-RUNTIME-INTEGER-BOUNDARIES",
    "A3-DEPENDENCY-CYCLE-INJECTION",
    "A3-DIRECT-GENESIS-PROVENANCE-MISMATCH",
    "A3-V2-NAMESPACE-MAGIC-DOMAIN-SCHEMA-REUSE",
    "A3-GENERIC-CARRIER-LOCK-SUBSTITUTION",
    "A3-CARRIER-NONMINIMAL-FINAL-REDEEM-WRAPPER-SUFFIX",
    "A3-TOKEN-AMBIGUITY-LANGUAGE-ESCAPES",
    "A3-PHYSICAL-CHAIN-IDENTITY-CLAIM",
    "A3-ROLE-LOCAL-INPUTINDEX-MISMATCH",
    "A3-STATE-POOL-ID-FOREIGN-OLD-NEW",
    "A3-PAF1-CODEC-VERSION-RESERVED",
    "A3-SEQUENCE-WRAP",
    "A3-STATE-BASE-CAPACITY-VALUE-EQUATION",
    "A3-PROOF-SUITE-STATUS-DIGEST-PAIRS",
    "A3-POOL-IDENTITY-FREE-MISCOMPUTED",
    "A3-CARRIER-COUNT-BOUNDARIES-N0-N484",
    "A3-CARRIER-SIZE-OVERLIMITS",
    "A3-TX-FIXED-VERSION-LOCKTIME-SEQUENCES",
    "A3-MONEYRANGE-AGGREGATE-OVERFLOW"
  ],
  "statusModel": {
    "states": [
      "PLANNED",
      "MATERIALIZED",
      "EXECUTED",
      "PASSED"
    ],
    "transitions": [
      "PLANNED->MATERIALIZED",
      "MATERIALIZED->EXECUTED",
      "EXECUTED->PASSED"
    ],
    "metaValidationDoesNotAdvanceStatus": true
  },
  "retainedSource": {
    "package": "spec:poolaction-fv2-falsifier-contract-v2",
    "contractPath": "research-lanes/bch-shielded-pool-design/spec/poolaction-fv2-falsifier-contract-v2/contract.v2.json",
    "contractSha256": "13919d017763871248757780958b16f5a3a4af0e1cc5efa0267de6c027743ffc",
    "familyCount": 73,
    "sourceStatus": "ABI_V2_IMMUTABLE_FAILED_ROUTE_EVIDENCE_ONLY"
  },
  "rows": [
    {
      "familyId": "RF-POS-NET-MAINNET-00",
      "lineage": "V2_RETAINED",
      "sourceFamilyId": "RF-POS-NET-MAINNET-00",
      "sourceGroup": "POSITIVES",
      "sourceClassification": "KEEP_UNCHANGED",
      "sourceLayer": "deployment-network-enum",
      "sourceDependencyGate": "N",
      "sourceMinStableVariants": "1",
      "sourceStatus": "CONTRACT_FROZEN",
      "status": "PLANNED",
      "metaValidation": "SCHEMA_AND_CONTRACT_ONLY",
      "mutationMetadata": {
        "mutationKind": "MIGRATED_V2_OBLIGATION",
        "targetFields": [
          "source-family:RF-POS-NET-MAINNET-00"
        ],
        "preserve": [
          "source-lineage",
          "source-reason-layer",
          "source-status"
        ],
        "expectedOutcome": "REJECT_OR_DEFER_AS_SOURCE_STATUS",
        "runtimeNamespace": "PoolActionFv2/falsifier-contract/v3",
        "requiredBeforeGate1": false,
        "mutationModes": [
          "source-lineage-preserve"
        ]
      }
    },
    {
      "familyId": "RF-POS-NET-CHIPNET-01",
      "lineage": "V2_RETAINED",
      "sourceFamilyId": "RF-POS-NET-CHIPNET-01",
      "sourceGroup": "POSITIVES",
      "sourceClassification": "KEEP_UNCHANGED",
      "sourceLayer": "deployment-network-enum",
      "sourceDependencyGate": "N",
      "sourceMinStableVariants": "1",
      "sourceStatus": "CONTRACT_FROZEN",
      "status": "PLANNED",
      "metaValidation": "SCHEMA_AND_CONTRACT_ONLY",
      "mutationMetadata": {
        "mutationKind": "MIGRATED_V2_OBLIGATION",
        "targetFields": [
          "source-family:RF-POS-NET-CHIPNET-01"
        ],
        "preserve": [
          "source-lineage",
          "source-reason-layer",
          "source-status"
        ],
        "expectedOutcome": "REJECT_OR_DEFER_AS_SOURCE_STATUS",
        "runtimeNamespace": "PoolActionFv2/falsifier-contract/v3",
        "requiredBeforeGate1": false,
        "mutationModes": [
          "source-lineage-preserve"
        ]
      }
    },
    {
      "familyId": "RF-POS-NET-REGTEST-02",
      "lineage": "V2_RETAINED",
      "sourceFamilyId": "RF-POS-NET-REGTEST-02",
      "sourceGroup": "POSITIVES",
      "sourceClassification": "KEEP_UNCHANGED",
      "sourceLayer": "deployment-network-enum",
      "sourceDependencyGate": "N",
      "sourceMinStableVariants": "1",
      "sourceStatus": "CONTRACT_FROZEN",
      "status": "PLANNED",
      "metaValidation": "SCHEMA_AND_CONTRACT_ONLY",
      "mutationMetadata": {
        "mutationKind": "MIGRATED_V2_OBLIGATION",
        "targetFields": [
          "source-family:RF-POS-NET-REGTEST-02"
        ],
        "preserve": [
          "source-lineage",
          "source-reason-layer",
          "source-status"
        ],
        "expectedOutcome": "REJECT_OR_DEFER_AS_SOURCE_STATUS",
        "runtimeNamespace": "PoolActionFv2/falsifier-contract/v3",
        "requiredBeforeGate1": false,
        "mutationModes": [
          "source-lineage-preserve"
        ]
      }
    },
    {
      "familyId": "RF-POS-CTX-DEPOSIT-N3",
      "lineage": "V2_RETAINED",
      "sourceFamilyId": "RF-POS-CTX-DEPOSIT-N3",
      "sourceGroup": "POSITIVES",
      "sourceClassification": "KEEP_RETARGETED",
      "sourceLayer": "TxViewV2/contextDigest",
      "sourceDependencyGate": "I,A,C,P",
      "sourceMinStableVariants": "1",
      "sourceStatus": "CONTRACT_FROZEN",
      "status": "PLANNED",
      "metaValidation": "SCHEMA_AND_CONTRACT_ONLY",
      "mutationMetadata": {
        "mutationKind": "MIGRATED_V2_OBLIGATION",
        "targetFields": [
          "source-family:RF-POS-CTX-DEPOSIT-N3"
        ],
        "preserve": [
          "source-lineage",
          "source-reason-layer",
          "source-status"
        ],
        "expectedOutcome": "REJECT_OR_DEFER_AS_SOURCE_STATUS",
        "runtimeNamespace": "PoolActionFv2/falsifier-contract/v3",
        "requiredBeforeGate1": false,
        "mutationModes": [
          "source-lineage-preserve"
        ]
      }
    },
    {
      "familyId": "RF-POS-CTX-WITHDRAWAL-N3",
      "lineage": "V2_RETAINED",
      "sourceFamilyId": "RF-POS-CTX-WITHDRAWAL-N3",
      "sourceGroup": "POSITIVES",
      "sourceClassification": "KEEP_RETARGETED",
      "sourceLayer": "TxViewV2/contextDigest",
      "sourceDependencyGate": "I,A,C,P",
      "sourceMinStableVariants": "1",
      "sourceStatus": "CONTRACT_FROZEN",
      "status": "PLANNED",
      "metaValidation": "SCHEMA_AND_CONTRACT_ONLY",
      "mutationMetadata": {
        "mutationKind": "MIGRATED_V2_OBLIGATION",
        "targetFields": [
          "source-family:RF-POS-CTX-WITHDRAWAL-N3"
        ],
        "preserve": [
          "source-lineage",
          "source-reason-layer",
          "source-status"
        ],
        "expectedOutcome": "REJECT_OR_DEFER_AS_SOURCE_STATUS",
        "runtimeNamespace": "PoolActionFv2/falsifier-contract/v3",
        "requiredBeforeGate1": false,
        "mutationModes": [
          "source-lineage-preserve"
        ]
      }
    },
    {
      "familyId": "RF-POS-CTX-EXCLUDED-BOUNDARY",
      "lineage": "V2_RETAINED",
      "sourceFamilyId": "RF-POS-CTX-EXCLUDED-BOUNDARY",
      "sourceGroup": "POSITIVES",
      "sourceClassification": "KEEP_RETARGETED",
      "sourceLayer": "TxViewV2/carrierSessionRoot",
      "sourceDependencyGate": "E,S,V",
      "sourceMinStableVariants": "6 = 3 mutation classes x 2 actions",
      "sourceStatus": "CONTRACT_FROZEN",
      "status": "PLANNED",
      "metaValidation": "SCHEMA_AND_CONTRACT_ONLY",
      "mutationMetadata": {
        "mutationKind": "MIGRATED_V2_OBLIGATION",
        "targetFields": [
          "source-family:RF-POS-CTX-EXCLUDED-BOUNDARY"
        ],
        "preserve": [
          "source-lineage",
          "source-reason-layer",
          "source-status"
        ],
        "expectedOutcome": "REJECT_OR_DEFER_AS_SOURCE_STATUS",
        "runtimeNamespace": "PoolActionFv2/falsifier-contract/v3",
        "requiredBeforeGate1": false,
        "mutationModes": [
          "source-lineage-preserve"
        ]
      }
    },
    {
      "familyId": "RF-POS-TOKEN-UNIVERSAL-GRAMMAR-0-4",
      "lineage": "V2_RETAINED",
      "sourceFamilyId": "RF-POS-TOKEN-UNIVERSAL-GRAMMAR-0-4",
      "sourceGroup": "POSITIVES",
      "sourceClassification": "HISTORICAL_CONTROL_ONLY",
      "sourceLayer": "Fv1-universal-token-grammar",
      "sourceDependencyGate": "T",
      "sourceMinStableVariants": "5 historical controls",
      "sourceStatus": "HISTORICAL_CONTROL_ONLY",
      "status": "PLANNED",
      "metaValidation": "SCHEMA_AND_CONTRACT_ONLY",
      "mutationMetadata": {
        "mutationKind": "MIGRATED_V2_OBLIGATION",
        "targetFields": [
          "source-family:RF-POS-TOKEN-UNIVERSAL-GRAMMAR-0-4"
        ],
        "preserve": [
          "source-lineage",
          "source-reason-layer",
          "source-status"
        ],
        "expectedOutcome": "REJECT_OR_DEFER_AS_SOURCE_STATUS",
        "runtimeNamespace": "PoolActionFv2/falsifier-contract/v3",
        "requiredBeforeGate1": false,
        "mutationModes": [
          "source-lineage-preserve"
        ]
      }
    },
    {
      "familyId": "RF-POS-TOKEN-CARRIER-NONE-STATIC",